用户名,时间,评论内容
哲科诺维斯基,2021/7/10,比较刺激，比较规范，比较开心，比较推荐。
hbI903251577,2021/7/11,【环境】 【交通】 【项目】 很好玩
匿名用户,2021/7/5,一点都不美……还那么贵！除了只有漂流，没有别的游玩设施……
PYQ565709831,2021/7/4,景色很美，管理很差，工作人员挺好
rKu916061772,2021/6/12,太坑人说了漂流两个小时，在水上玩了半个小时，其实真正漂流也就一个小时，漂完过去荡秋千35块说五分钟，系安全带就要四分钟也算就荡了一分钟，真是给尧山差十万八千里，以后再也不回去了
fan15035928038,2021/7/5,漂流里面我觉得黑洞里应该弄些灯，要不太危险了
叶天心丶,2021/7/8,刺激～～～～～浑身湿透～～～～
GAO880802,2021/6/23,很好玩
Dhj0925,2021/6/9,每一年都都会去 比较刺激
tok669073045,2021/7/10,还可以
GvU438314193,2021/7/4,没人维持秩序，超级乱，排队4个小时队，骂架打架
OGU964698613,2021/6/10,就是里面收费的项目有点多，像运衣服，停车场停车收费，漂下来上去坐车还得收费，收什么费用应该人去之前票上详细说明，漂流幸亏拿手机了，没拿手机坐车还得收费都上不去了
eKV368631490,2021/7/1,就觉得漂流托运衣服收费， 还有返程的车收费，不合理。
秋意浓,2021/7/1,还可以，就是没有规划打水仗的区域，有些可惜
匿名用户,2021/7/3,一般只有漂流，孩子都没啥可玩的……
石洁雨,2021/6/29,漂流安全刺激凉快！环境优美！赞
长新饭店,2021/7/1,尧山比这强 谁来谁知道 一般一般世界第三
Qcj229458012,2021/6/30,水脏，回程的车都不开空调热死了
ljh850933562,2021/6/30,水真的脏，长了一身的小痘痘，垃圾，
泯灭活人辶,2021/7/5,🤣🤣🤣🤣🤣🤣🤣🤣
Xl52111,2021/7/3,挺好的
特搜咯,2021/6/30,挺好玩的，不错不错
tww224246737,2021/6/24,不错不错体验感很强、唯一不足就是票价贵觉得玩的太少
匿名用户,2021/6/2,服务非常差，出去的时候忘记开发票，结果说离开就不能开发票了，这得省多少税，而且我的心爱的帽子丢了，工作人员说没看到，反正没有一件服务是满意的！！
夏雨杰,2021/7/1,挺不错的，可以去亲身体验
大琳i1,2021/6/29,挺好的，很好玩，准备下次再去
iWC110029039,2021/6/28,还不错，自驾很方便，进园很快，
xxZ896973688,2021/6/22,水略微有些脏，人很多漂流全程一小时多
BTh242963435,2021/6/28,今年准备再去
BTh242963435,2021/6/28,今年准备再去
匿名用户,2021/6/7,设施太欠缺，返回车太少，大太阳下等了一个多小时，食宿太一般，不回再去第二次的“景点”耽误事
小ym可爱,2021/5/12,最最最差的体验 水质脏臭 味道很大 什么地方都需要收费 过程很短 还没玩就到下面 洗漱的地方就只有水 其他都需要收费 连个吹风机也没有
ZH小飞机,2021/6/20,总体还行吧，值得一去，其他也没啥说里了！
匿名用户,2021/6/7,漂流一个多小时吧，总体来说还可以吧，黑洞还比较刺激，水不是很干净，看个人情况而定
Rte813583139,2021/6/23,不错，玩得开心
kHL385568129,2021/6/23,还行吧
bZT504701871,2021/6/22,可以
lkpopfly,2021/6/14,漂流设计规划安全刺激，美团优惠价用的放心！
嘿，宝贝儿r,2021/6/12,用盆的水仗打的过瘾，干净的衣服得存了到漂流终点换。
0321di,2021/6/6,收费小车居然要10块，游艇挺脏而且景区项目又贵又不好玩现在
那船,2021/6/13,还算比较满意
过客Gsx,2021/6/14,明天继续去，
匿名用户,2021/6/9,很棒，很喜欢。
抱紧月亮Y,2021/6/6,【环境】 【交通】 【项目】 【餐饮】 【餐饮】 【项目】
匿名用户,2021/6/5,很好，很刺激。
是鱼白羊,2021/5/12,怎说呢， 漂流地下太多石头了 两个人老搁浅，不是很好玩，很影响体验
在路上3195,2021/5/28,全程没有爬山，谷底一路行走，还可以。
Lanjingling.,2021/5/29,一般般吧 小孩休息配套设施不完善
匿名用户,2021/5/23,不错，一家人出去玩，走到最后有孩子玩的网红桥等，很不错
Msn698341261,2021/5/25,没有带身份证自己买的票 还不退票 真垃圾
匿名用户,2021/5/20,最差的一次体验，态度极差，设备陈旧，异味大，
amZ466711989,2021/5/20,好玩，很喜欢，还会再去的～不错，不错。
海蓝色的天空98,2021/5/3,还可以。不错，天气好漂流很刺激，好玩
VfN948233080,2021/5/1,还不错 带孩子来玩的就是激活的时候有点慢
雅韵1429,2021/5/4,豫西大峡谷漂流挺好的，值得游玩
SHT995145602,2021/3/16,就是路程短了，玩不尽兴。。。。。。。
陈皮脸,2021/3/18,😊😊😊😊😊😊😊😊😊
FHa827548803,2021/3/6,每年都去
Chet霸气,2021/2/15,惊险，刺激 ，就是时间有点短，下次还去
公主娃娃DHY,2021/1/30,好玩，刺激
流星,2021/1/21,带孩子玩了很多次，感觉还不错，旅游的好地方
小耳朵7664,2020/12/31,好久之前去的了 挺过瘾 就是水有点冷
Yang斌J,2021/1/8,很棒，人不多，玩的特别开心。强烈推荐
Cpl477107387,2020/12/23,后面让我们看看漏财虐金牛座母亲啊老婆有一天荣我裤子我默默
m05190,2020/12/28,😊😊😊😊😊😊😊😊
m05190,2020/12/28,😊👍😊😊😊😊😊😊
齐苏雨1314,2020/12/26,第一次去玩漂流 就是有点累😂
匿名用户,2020/8/11,"玩的很开心，很刺激，只不过手上的指甲被船给从中间挂断了，问岸上的工作人员他说只能到终点去消毒。但是除门票之外路费太贵，去这里的一定一定要开车来有停车费小车五元大 <span class=""feedbackmore"">车十元。我们出了高速以后就下车了，再去景区的话没有专车只能打的，(有班车但是时间不定很久才有)也有面包车可以送你上去但是！要五十块，我们两个人，12公里的路程要五十块，打的都比他便宜。我们出来的时候因为班车太长时间才发车所以选择自己走，走到门口的时候想打的走遇到了99号旅店(在景区外面)的老板给我们要40给我们送到高速路口(再次强调只有12公里)最后我们给了他30。再说景区里面漂流下去之后再坐上来一个人30。这里的交通费是真的贵。我们住的是3号宾馆在景区里面老板挺好的，吃的也不贵点的菜只踩了一个雷，睡的环境就是普通的农家宾馆的环境，就是洗澡的水有点凉，不过夏天也没有什么。总的来说除了交通真的一言难尽之外我其他的挺满意的 <i class=""text-icon icon-toggle-arrow"">"
林小夕zy,2020/12/9,很好
YdQ285160858,2020/12/5,不怎么样， 和骗人差不多 一点也不实惠
匿名用户,2020/12/3,很好，环境很美，有机会下次还会去
WeL708522054,2020/12/4,强烈推荐
RoW249319811,2020/11/30,很刺激。第二次过来玩了。
TUskyler,2020/11/16,如果不是漂流的话就别去了，除了漂流没什么好玩的
sxdyf1314,2020/10/22,很好玩 每年一次 漂流终点有热水洗浴
鱼鱼鱼豆腐豆腐,2020/8/16,"漂流玩的还不错，一起来的人越多越好玩，建议一定要早点去，去晚了路上和景区门口很容易堵车，停车5元也不贵，先漂流，把换洗衣服，毛巾，和零食装一个袋子里托运到漂流终 <span class=""feedbackmore"">点，10元一个箱子，大概比鞋盒大点自己把握，漂流结束后，有免费洗澡，洗干净换好衣服，一路走回来顺便看景色，游玩结束~不足之处，救生衣安全帽都是湿漉漉的还很脏有发霉痕迹，不能弄个烘干消毒的设施么？玩水带盆，瓢，或者能直接从水里吸水的水枪，其他都是辣鸡。穿凉鞋，拖鞋，夹板鞋去，做好全身湿透的准备，什么雨衣都不好使 <i class=""text-icon icon-toggle-arrow"">"
翟小七0330,2020/11/1,太短了，感觉也就一个小时吧，一般般
婉婉张,2020/10/16,十一假期去的 下着雨顾客很少 景点还行 起码不会人挤人 小交通收费太贵有点坑！
趣步壹杯红茶,2020/8/1,"豫西大峡谷的景色很美，漂流很刺激，坐在橡皮艇上，穿过鲤鱼跃龙门，龙头门，钻了两个300米的山洞，山洞里的减速带颠簸的很有节奏感，最刺激的就是最后一关，滑道，景区 <span class=""feedbackmore"">安保措施很到位，值得一游。但是不玩漂流的，可以从正大门的左手边小道进入景区，不需要花50元买门票。 <i class=""text-icon icon-toggle-arrow"">"
wQo850063890,2020/10/22,好好
ZW半夏微凉Y,2020/8/26,听别人说漂流的时间长，去了不长，也就一个小时多点吧
匿名用户,2020/8/27,全程水太小，不够刺激，水还特别脏服务也不好，不会再来绝对差评，
zTx563897603,2020/9/7,景色真心不错，特色项目漂流，由于时间关系没有体验，挺遗憾的！
wJ没心没肺,2020/8/15,和家人一起去的，整体还算满意！
隱隱的淚,2020/8/27,风景美丽，漂流刺激，夏季游玩好去处
刘很饿,2020/7/19,"在网上看了很多，选择了这个。尧山大峡谷漂流我去过了，所以想试试其他的。这里水是真脏，臭!腥!时间一个小时多点吧。唯一的亮点就是有个黑色的山洞，黑乎乎的，比较好玩 <span class=""feedbackmore"">。其他的都是捆绑销售，各种收费，到终点回去一个人收费30，那个衣服托运10元。给个玻璃栈道体验需要买票过去。唉，不建议来，不如尧山。去尧山吧还是。 <i class=""text-icon icon-toggle-arrow"">"
大哥,2020/7/12,"豫西大峡谷漂流，漂流真的是很棒，真的很不错，推荐大家快和好朋友组团一起去打卡！！！这个漂流全程时间很长，而且过程惊险刺激，很过瘾的！哈哈哈哈哈，温馨提示建议大家 <span class=""feedbackmore"">去的时候做好防晒工作哦，不然皮肤容易晒黑了。 <i class=""text-icon icon-toggle-arrow"">"
zz.梧桐树,2020/8/10,一起漂流吧，来感受豫西漂流的魅力 觉得那天的水流有点小，不过还是玩的很开心哈
匿名用户,2020/8/2,豫西大峡谷，漂流可美了，挺刺激的，喜欢漂亮的朋友们可以去玩玩，让你去了还想去玩，玩的嗨
吴骞小老弟,2020/8/17,吊车还是可以，一条木的，一条玻璃的，来回换着走，就是玻璃观景台不好，太小
匿名用户,2020/8/9,"从老家赶过去的，大概花了两个多小时，算是三门峡周边最值得玩的地方了，环境清幽，服务周到，和老婆一起去的，玩了整整两天，白天玩玩漂流，晚上在广场看看节目，感觉特别 <span class=""feedbackmore"">惬意，唯一感觉景区中午的饭一般般，下次还会去 <i class=""text-icon icon-toggle-arrow"">"
wyljxz00.,2020/8/10,漂流水是真的脏，泥水一样，还好可以免费洗澡，还挺刺激，就是有点短，没玩尽兴
nml4513194,2020/8/19,漂流贼好玩，马上要去第二次了
曹43893494669,2020/9/13,最好是别带孩子去！最后一段比较危险！
jRA686600792,2020/9/7,时间挺长，中间有比较平缓的平台可以休息，，水质比较干净，也有比较刺激的部分
z18295961613,2020/7/29,这里的漂流项目挺刺激的，适合身心疲惫的亲们亲身体验！ 家庭散心的好地方！
ivanhappy,2020/8/16,居然没有人告知，也不知道需要把衣物托运到终点并在终点冲淋，等我们回到起点才知道，郁闷，只好找了家农家乐付钱冲洗的
ruoruchujianli,2020/6/22,「豫西大峡谷漂流」「大淙潭瀑布」「挡箭石崖」「濯足池」「三叠峡谷」第一次去豫西大峡谷漂流，很好玩，很刺激！
吴骞小老弟,2020/8/17,吊桥可以玩，玻璃景观有点坑，太小了
奥迪用车出租,2020/8/22,还行，就是收费坑了，以前飘完10块钱就下来了，这次要30，以后不去了！套路太深，景区买的蒸饺都发臭！
fMc45573868,2020/8/2,玩的很开心，唯一一点美中不足的就是救生衣太脏了。
wendy_若梦,2020/8/12,刚下过雨 水有点混
ckD180457647,2020/9/1,下午3点多过去 都没水了 一点儿都不刺激
山西叶子,2020/8/29,挺好的，尤其是60岁以上免门票，太满意了！
Yec131785374,2020/8/29,就是儿童票有点小贵😯玩着还是挺不错的☺️
超级茉莉的妈咪,2020/8/25,每年都去漂流，每年都有不一样的体验，好玩儿🥳
ZW半夏微凉Y,2020/8/26,风景不错，超棒哦哦，建议他家去玩。
青涩de番茄,2020/8/12,豫西大峡谷这段时间还是不错的，买漂流的票送进场门票。漂流好玩，据称挺长的，快两个小时。
Mr_bai、,2020/8/22,除了，停车收费，返回坐车30一人以外，基本没啥了
超级茉莉的妈咪,2020/8/25,好玩，每年都去，
未有心软之神,2020/8/28,挺好的
xiebinbinya,2020/8/22,漂流的时候很好玩儿，水也不凉。
九八,2020/7/25,满意的地方不说了，漂流确实不错，不满意的地方是到了终点如果坐电瓶车回来的话，票价是每人30，比较坑，还有就是要团购42元的那个的提前两小时买，需要注意
紫兰色月光,2020/7/28,水量很大，漂流船质量很好，漂流途中的安全防护人员很负责任！
匿名用户,2020/8/18,环境很好，玩的很开心
Y哆啦A梦的袋鼠兜,2020/8/13,玩的还可以，水有点脏，水道有点短，不是很刺激
rmb790484414,2020/8/11,设施不错，服务人员也到位，就是感觉没有6.2km，玩的不是很过瘾。
Qtc246287579,2020/8/1,很刺激，风景优美
Qtc246287579,2020/8/1,很开心，风景很美
kDc831703890,2020/8/13,很刺激很刺激，很好玩很好way，真的很不错，值得一去，喜欢水喜欢刺激的人很值得一去。
匿名用户,2020/8/12,比较偏，农家乐费用很高！住宿一般般吧
想你19999,2020/8/18,景美，好玩
三宅一生71,2020/8/11,去了第四次了，水稍微有点脏，其他还好
PfV700466537,2020/8/13,一般草草草草把笔名我给弟弟呵呵呵额呵呵呵嘿呵
kvD417163948,2020/8/13,夏天和漂流实在太配了，超级爽。
喽嗨喽嗨de,2020/8/10,开心刺激而且河道还长
游鱼9197,2020/8/4,很美，很刺激，风景也不错，去的时候天气不冷也不热，很不出错，有机会还会去
Ualtin,2020/8/12,好评
NRf749587461,2020/8/2,整体很平缓，没有什么落差。水很脏，游玩感觉一般～l
匿名用户,2020/6/25,"跟别的漂流比 性价比不高 不会来第二次。漂流全程很短 门票也不含回程大巴。一个人30 真的坑。运换洗衣服到下游洗浴处要收快递费。一个盒子只能装两个人换洗衣服。那 <span class=""feedbackmore"">为啥不把洗浴安排在上游停车场位置。花里胡哨没一个实用的。 <i class=""text-icon icon-toggle-arrow"">"
xGa193840753,2020/7/27,最后一个洞管理人员把握不好时间，这边还没下去，另外一个人都能怼人头上，恶心人
gqxwlp8155,2020/8/5,孩子玩的高兴！期待下次会更好！
申小妤,2020/7/16,漂流很好玩的，夏天必玩项目。爱好漂流的可以行动起来啦。
姜磊stone,2020/8/6,极限漂流，安全刺激，取票方便快捷
AAC732,2020/8/1,已经去过好几次了，都觉得非常不错，离家200多公里，依然过来
tcZ239883309,2020/8/7,比景点买票便宜好多！
行走江湖1981,2020/8/5,刺激，泼水挺好玩
kkkkkm730,2020/8/5,很好玩，明年可以再来，赞赞赞赞赞
Xev336335559,2020/6/22,很刺激，就是水不太好喝，去的时候要带挺多东西的
yUO949497228,2020/8/1,很好玩！孩子特别开心！值得一游！
微笑代替情绪M,2020/8/2,和朋友玩的特别开心
匿名用户,2020/7/30,漂流挺好玩的，景区其他景点没啥意思
TiR833645572,2020/7/28,挺好的，洗澡水是凉的，如果是温水的话更好
BYx429445462,2020/7/30,玩得很开心
pvm978656588,2020/6/25,绝对差评，几个平方的小地方就敢收这么贵，买票的一个劲的忽悠一百种音效什么的，根本不值当
zhao000311,2020/7/26,非常棒，很刺激超级棒 想来的赶紧来，加油
文冬冬,2020/7/25,不错
iAO193731348,2020/7/20,不错，刺激，最好的是终点站就可以洗澡，可以干干净净的继续游玩
star20885,2020/7/22,可以可以的环境不错 舒心 凉快 身舒服
匿名用户,2020/7/22,环境不错，值得一去！
此生思念,2020/7/18,还可以，有几个点还挺有意思，没有栾川那边那个长。
ckD180457647,2020/7/19,下午去的 水太小了 费劲死了 还得自己划船
淡静中平凡,2020/7/21,你收费能一次收完吗？哪哪都有收费
朱国敏1994,2020/7/17,还可以吧？出来不要忘记带衣服。11111111
abM915453965,2020/7/1,观景台很一般，吊桥还可以。感觉不值这个价钱。很小的玻璃台子。不建议玩这个项目。
hRH842992372,2020/7/10,一般一般就是就是技术监督局点解点解电话号度都好都好嘟嘟
霹雳得鹰,2020/7/9,还好吧，好多人素质不太高就是，建议注意安全
CdI144745949,2020/7/7,就是买错漂了去漂流买了套票应该就买漂流的票就可以了白花了几十块钱
一笑而不语一,2020/7/13,还可以
一笑而不语一,2020/7/13,还可以
匿名用户,2020/5/28,漂流很刺激，时间很长，浪大水流湍急，还把一只拖鞋冲丢了！
匿名用户,2020/5/26,挺好玩的，就是水是真的脏，小虫虫太多，去时没注意看有个快运是运干净衣服的，结果漂流下来全身湿透，只能坐景区车返回停车场换衣服，一个人30元不到五分钟就到了，这个比较贵
fFA981477107,2020/7/1,不错不错，直接漂流然后走上来看风景
fFA981477107,2020/7/1,漂流很刺激，山里环境非常好
匿名用户,2020/6/27,水质差差的厉害，过敏发炎。 垃圾景区
rMN371642943,2020/6/25,就是附近的住宿条件太差，玩的是真的好。
Ras871972878,2020/6/27,带孩子去玩的，很开心
Ras871972878,2020/6/27,带孩子去的，很开心
匿名用户,2020/6/8,漂的很爽。
不要害怕我在身旁,2020/6/8,垃圾死了辣鸡景区 河南最垃圾的景区水真的脏 还有飘下去只能做缆车上去 离停车场超远 还不让开车进去
TFv706147088,2020/6/24,售票员的服务极差 非常差 非常不满意
wou785513241,2020/6/20,以为会很刺激，结果就是第一下刺激，剩下就很无聊了
wkL986375503,2020/6/14,水质不太干净，漂流挺开心的，漂流回去不要坐车还能看看风景
匿名用户,2020/6/12,其中有一段比较刺激，其他的时候都是比较缓慢进行的。
刘博奇,2020/6/6,美团必须买了四小时以后 柜子这次去不能用 水里虫子多
Nop716383787,2020/6/10,门口卖一进门卖凉皮的不仅脏态度还很恶劣
yHA261400761,2020/6/8,差评差评 漂完流 自驾车开不下来 穿着试衣服上去
iqK635623611,2020/6/3,很好，女朋友很开心
萍萍,2020/6/6,一定要漂流
匿名用户,2020/5/30,还不错，就是维修，然后没有漂流到最下面，有点小遗憾
JMj315607039,2020/5/28,挺好的玩的开心就好123456789
冬日sunny,2020/5/19,真不错，漂流长，通道体验惊险刺激，希望下次还能玩
evy505920248,2020/5/12,已经去了两次，很刺激
不二少年’,2020/4/30,还可以，也就一般，没有想象中的那么好玩。
Tdb775869759,2020/4/25,不错不错，娃们打水仗 开心开心，主要是小孩玩
Tdb775869759,2020/4/25,娃们玩的挺开心，特别是最后的那个洞 刺激
落叶知秋心儿,2020/4/25,环境还可以吧
cHJ345360483,2020/4/17,很普通的漂流，不是很惊险！带孩子可以去玩一下
Ycmled,2020/4/14,挺不错的，跟女朋友一起去的，有两个老头有意思
皮皮888666,2020/4/17,非常好玩 强烈推荐
egc360269124,2020/4/6,设施全，环境好，天然氧吧，玩的很刺激
Rebecca,2020/4/8,一般般，门票价格太贵了，不会再去
梦里有饭我要减肥,2020/4/2,还可以吧，人太多了一壶人，漂不下去，哈哈。
tfK374336764,2020/3/31,购票服务差，水太脏了，大家请参考
lemon19861225,2020/3/14,漂流挺不错挺刺激，就是去的时候有点冷，穿的雨衣没什么用，衣服全湿透了
东虎爱喵喵,2020/3/21,环境不错，漂流很好玩，景色优美！
加菲猫,2020/3/18,设施不错，风景如画，漂流惊险刺激让人难忘
匿名用户,2020/3/15,风景美，环境空气好，漂流刺激，夏天没事到这里玩
太懒没留姓名,2020/3/14,不错的地方，值得推荐
Kgm629885065,2020/2/7,太好玩了
骄傲lion,2019/12/3,漂流必去，时间长，夏天太多了半天划不过去，然后到哪里还要排队才能下去，感觉要被晒死，阿西吧，人多时候去可不美，不过风景很好哈哈哈，好玩
匿名用户,2020/1/21,激情漂流
HNk139549251,2019/12/7,在西北地区，算是很不错的漂流了，但是，所有漂流体验的通病就是，救生衣和头盔都是臭的，不专业，感觉没有特别专业的人员管理，总像是不正规的体验项目
pmX515658090,2019/12/24,过隧道挺吓人的，整体还不错。刺激
一天存两块,2019/12/26,挺好玩挺刺激的推荐
我要好吃的3,2019/10/28,来的季节不对，景区里杂草丛生，落叶满地，几乎就我们一家人在里面游玩，如果是夏天来的话可以玩漂流。
wTL375617446,2019/12/1,超级刺激 这是目前玩过漂流最好玩的一次啦！强烈推荐，每个隧道的什么都不一样。让人充满惊喜期待
x可乐mama,2019/12/14,和朋友一起去的。 爽
昱颖,2019/7/22,"友情提示：首先大家准备漂流的干净的衣服，还有就是防水手机壳，干衣服可以做快运到山脚收费10元，买的拖鞋15一双，有不是运动鞋的不用买，本来是兴高采烈的来的，天气 <span class=""feedbackmore"">不错阴天，但是真正下水的时候有点冷玩的一个小时多，水有点脏，有洁癖的慎入，所有的救生衣都是湿的，领口发霉了感觉，最最不能理解的是当你开心的走出来的时候，洗澡的地方没有热水，脏的要死，水流的简直是滴的，这就算了，反正就是没有另收费，就没有服务可言，下山做的巴士，一个人30元，也可以选择走，十公里左右！再下来就是住的问题了，找了一个多小时基本都是88元的民俗，卫生程度太一般，价格也不贵，就是找哪里哪里满，这个体验是真差劲最后老公让我等着说他去找，二十分钟左右，天空又下起了雨，老公说找到了，带我一看，就那环境还敢要299元，话说原价398元，瞬间爆炸，我说明天也没啥玩的，直接回市里不是更舒服吗，就开车走了，总而言之，漂流还可以，其他的就不多说了，感受好差！ <i class=""text-icon icon-toggle-arrow"">"
TEx488224355,2019/11/24,主要漂流去了，人很多，救生衣和帽子太脏了，物品存放也不方便，收费太高。
Dcy159015847,2019/10/2,"超级超级差评，游客服务中心不是为了让景区更好吗？商家限制的不可退，在付款前为什么不显示？我想换一下票又不是不进去，并且原价付，这都没问题。我只是建议一下把这个限 <span class=""feedbackmore"">制退票改一下，为了防止以后有人不小心点错退不了票。不听建议都骂人贪图便宜才团票，既然买了就不能退，我去了那么多地方真是没见过有这种！你要是不想让用美团，就别在美团上卖这个券啊！ <i class=""text-icon icon-toggle-arrow""> 商家回复： 2019-10-20 抱歉没有给您带来美好的旅行体验，祝您在今后的旅途中开心快乐"
傲曼曼,2019/11/21,景色宜人，设施建设完善，游人相对觉少，适合避暑游玩。
匿名用户,2019/10/31,景色宜人，有很多小鱼，山涧溪水～是个漂流的好地方
匿名用户,2019/11/15,除了离的有点远，其他还好吧。。。。值得一去
huangguohua2013,2019/10/24,真不错 玩的特别尽兴 找个七八人去玩挺好的 很好玩
jCx313905743,2019/11/10,方便，快速买票
一笔撩灶,2019/10/3,漂流没话说，但是买票的地方和刷票的地方服务态度相差太大，我两个大人带个小孩子买票的地方和服务台都说可以，到里面刷票进去的地方态度特别恶劣，说不行还JJWW 的，瞬间让人没有心情。
wEU266221533,2019/11/4,好
哈根达斯2011,2019/8/11,"美团买了3张，实话实说一般般，不是周末去的，12点半开始漂流，大约1点40分漂流完，就按照水流的速度正常漂流完，很快，没想象的要漂3个小时，关键河道边也没停留休 <span class=""feedbackmore"">息的地方，正常速度漂流也就1个半小时，另外看了一个小瀑布，就走了，还有就是漂流完洗浴很简陋，洗浴房建在山上，里面蚊子很多，我没看见香皂洗发膏之类，一定要自己带， <i class=""text-icon icon-toggle-arrow"">"
王昭749,2019/8/13,"还行吧，第二次去了，美团订票很方便，不过必须得提前两个小时订票。不过只能在终点洗澡，去年是回来之后在起点冲澡。换地方了也不给游客说清楚。景区内的东西还好，不是特 <span class=""feedbackmore"">别贵。感觉今年的水流没有去年大，水也没有去年深，好多地方水很浅，船搁浅了好几次。 <i class=""text-icon icon-toggle-arrow"">"
