用户名,时间,评论内容
HXm127112081,2018/7/1,设施一流，服务周到，玩着惊险刺激，物超所值，
SaV300556493,2018/8/22,挺好的，可以去玩玩。漂流轨道挺独特的
QHz672995622,2018/8/15,很不错，一大家人去了直接买了7张票，也挺划算的，希望景区发现更好
郭科科LOL,2018/7/23,环境不错风景不错玩的很刺激老爽了
匿名用户,2018/7/29,有点黑心，漂流下去不让走小路，那就得坐车，很短短路程就要三十元一位。大家怎么看！还有说好的返现24要元也不给，明显的欺骗行为，我也是无语呀
匿名用户,2018/7/29,当时参加的返现活动，说让好评返现，眯着良心好评了，结果24元也没有返现，客服说一大堆就是不反，太坑了，反回来的车票一个人就要30，咋去打劫大家千万不要上当了
阮晨奇,2018/8/25,很不错
JYX351319706,2018/7/28,风景优美，很有激情的漂流，夏天避暑的好去处，一次满意的游玩
uKs914518359,2018/8/8,时间可能长了，钱挣得也太多了。里面很深，无人引导，漂流完觉得地方挺好，管理有点跟不上了。
匿名用户,2018/7/24,今天天气不错，人也多，很刺激，玩的很开心，期待下次继续游玩，没去过的强烈推荐！
帝都胖哥哥,2018/8/21,挺好玩儿
老白不喝酒,2018/8/22,还不错
老白不喝酒,2018/8/22,还不错👍
柳橙唯心,2018/8/22,服务很好！门票可以管两天
袁pccccc,2018/8/21,很刺激！不错
eqO725136858,2018/7/18,很刺激，和游客打水仗很过瘾，去的时候水枪，
hOz414011890,2018/8/20,门票太贵了不值得，漂流可以推荐
美食林子,2018/8/11,漂流过程很爽，水看着也干净。就是门票必须买有点亏。50元呢
李维737,2018/8/18,还行，去了两次了，就是中途拉人的不太负责了
nAS646029710,2018/7/1,设施齐全，安全可靠，玩的很开心，很尽兴！好评好评！
LPo528196955,2018/8/7,和家人自驾游，孩子喜欢，门票和漂流的票在一起不合理，漂完也没逛，钱白花了
YovLoGg,2018/8/14,第二次去了 很不错！ 很尽兴～ 推荐朋友来玩了明年还会再来
uQM303554337,2018/8/15,水面飘着青苔，水太脏，建议女士不玩最好.
匿名用户,2018/8/11,服务态度真恶劣，没有第二次了，真心无语了为了钱什么道德底线都没有。
zAZ186415683,2018/8/15,景色秀丽，是个旅游散心的好地方。漂流挺好玩的
ffY636692651,2018/8/21,很好玩。很刺激
匿名用户,2018/7/28,豫西大峡谷漂流确实更刺激好玩一些，峡谷风光可以也是漂流景气里更胜一筹的，夏天峡谷的风吹在身上透着股凉爽，是一个值得一去的漂流胜地。
cZb277972716,2018/8/4,垃圾中的战斗机，千万不要来，配套设施全部收费不说，工作人员个个像大爷一样！弄一肚子气！
米其林餐厅的吃货,2018/7/18,每年都来豫西大峡谷，每次都是带着媳妇来漂流，每年都是这个时候，每次都是这家农家乐！惬意，带劲，意犹未尽呀！！哈哈，没办法呀，条件便利，开车一个小时的路程就到了！
遇见521,2018/8/14,「豫西大峡谷漂流」好玩～惊险刺激！
xTE681355569,2018/7/18,挺不错的，就是顾不上拍视频
Eee279913963,2018/7/19,太棒了，今天漂的有两个小时左右吧，漂流很好玩，很刺激，沿途风景也好，安保工作做的不错！ 建议去的时候人多点，比较有意思！ 唯一的遗憾是没有拍照...
aJM611275037,2018/8/15,「豫西大峡谷漂流」，很刺激啊，不错不错
匿名用户,2018/8/12,漂流很刺激，推荐大家可以体验，大概2小时
匿名用户,2018/8/8,挺好玩的，水流大，时间长，不错
匿名用户,2018/8/10,非常不错，景色特别美，漂流也特别刺激
smxrwf,2018/7/7,环境很好，心旷神怡，不错的一次旅行，一家人都玩的很高兴。
匿名用户,2018/7/3,很刺激，很爽，今天天气不太好，玩着也不冷，哈哈
zAZ186415683,2018/8/15,漂流可以，比较刺激
BzO240884700,2018/8/3,第二次漂流，比十年前强多了，飞龙洞，凤祥洞，勇士洞，够刺激。十年后再去。
WOw932879643,2018/8/10,「豫西大峡谷漂流」特别好玩刺激
LKS刘鑫,2018/8/4,真的是拿大把的钱砸在了广告费上，然后到园里猛坑顾客，真的很失望
匿名用户,2018/8/8,就漂流了下，啥也没了，问他还有别的项目，说没了，感觉太贵了
匿名用户,2018/8/8,很好玩，很过瘾，不错。防晒要做好
匿名用户,2018/8/7,不值这个价，门票订的太高了，水流也不是很好，
yin1573,2018/8/7,不会再去第二次.检票人员态度非常不好
Tiv345498714,2018/8/8,还不错，挺刺激的，就是门票稍高了
lmW978566021,2018/8/7,老板人很好！饭菜很好吃！特别推荐红烧茄子！
隔山打铁锤,2018/8/11,还可以就玩了漂流，别的没玩下雨了
匿名用户,2018/8/3,这地方不行，太坑人了，反回坐车，不到十分钟，竟敢要每人30元太他MB坑他爷奶
匿名用户,2018/7/31,收费有点不合理，漂流挺刺激，沿途风景也不错，停车场环境很差，一般般
x496120853,2018/6/8,下雨天去的，空中索道……一般，挑战最后面的项目比较值得！而且票是重新买，不包含在门票内的
nAz990592850,2018/7/21,环境很好，玩的很好，强烈推荐，善良
OTV785389592,2018/6/12,刚去觉得一般但是到12点之后人也多了河道里的水也多了，挺刺激的！
zzy19950623,2018/7/7,超级爽的漂流，很刺激，很好玩，见到人就干架，太刺激了。
vBA547311837,2018/8/1,工作人员的态度不太满意，漂流过程还是挺好的，挺刺激
_weixin598096406,2018/7/31,服务差的一匹，没人管事，美团出了票没用也不给退钱***表示不会再去
起凬拉,2018/8/11,只有漂流
起凬拉,2018/8/11,只有漂流
AAM753305273,2018/7/28,漂流玩着还可以，就是景区太坑了，什么都要钱，漂流回来做个大巴要三十，坑爹呢
PSz697963290,2018/7/18,还不错，一般，时间太短，一个小时，没有两个小时。
FdP451928768,2018/7/29,害死人的美团，1.2米以下儿童免费不能漂流，带孩子的购票请注意，退票太难 商家回复： 2018-07-30 很抱歉给您造成困扰，我们在售票界面有说明1.2米以下儿童是不能参与漂流的，请各位家长酌情购买漂流套票，电子票一经取票无法退款，购票若有疑问烦请致电商家咨询，谢谢合作！
YkR178216667,2018/7/24,服务人员的工作态度超级差，从售票，检票到漂流途中服务人员，一个比一个差，我又不欠你们钱，到哪里不是漂
匿名用户,2018/7/20,位置很好找。漂流也很刺激。喜欢漂流的伙计赶紧去吧。不过要提前订票。强烈推荐的。 。 那什么时候返现。赶紧返现吧
Dsd133322127,2018/7/29,环境好，非常喜欢里面的漂流，孩子们玩的特别开心😊，特别推荐夏季来此处游玩
匿名用户,2018/8/4,同事很多人一起去的，很high，值得一去
匿名用户,2018/7/26,还可以、就是收费的太多、价格都那么高了还要其他费用，连洗澡、柜子啥都要收费、
BBx732100484,2018/8/5,很一般的景区，很一般，漂流也不行
萌小鹿呀,2018/7/20,玩的超级开心，湿身
Look929,2018/6/14,很棒好玩的很 绝对值得一试 ！！！！！！！！！！！
我不怕69,2018/8/3,服务可以，但是收费有点高，尤其是交通费。
ERr153563179,2018/7/29,还行，水流太慢，也太浅 速度不是很快，石头阁的人也难受
_qqvf71437574169,2018/8/2,环境挺好的，漂着也很刺激，尤其是那两个洞，真刺激
刘易霏lyf,2018/7/20,好好好，每年都会来
萌小鹿呀,2018/7/20,很开心，玩的非常爽
马铃斐,2018/7/30,不是一般的差劲，建议不要去，美团也是醉了 【项目】
发挥极致152,2018/8/3,一个字坑 ；；两字太坑，一米二一下全票。
人_在_江_湖,2018/8/6,很好玩，大家值得去玩
匿名用户,2018/7/21,漂流票没问题，挺好玩的，就是这个门票纯粹扯淡，进去都是漂流的，加这么贵的门票干啥？除了漂流有啥可看的来说说
匿名用户,2018/7/29,以后谁在说好都是骗人的，太差劲啦，钱倒是不少收，无语
toM104259068,2018/7/19,666棒棒哒！
HuangFuYouJian,2018/7/18,漂流很刺激，环境很好
WZHANJT,2018/7/29,设施可以非常不错，刺激。听说今年又变长了
chy1992718,2018/6/23,专门多开三个小时过去的，很不错没有失望。价格也很便宜，就是太远啦……回来的时候整整开了10个小时的车，回到家累蒙圈了……
vKj191746182,2018/7/31,门票不包含车票，真的有点骗人！！！！ 商家回复： 2018-07-31 您好，套票只包含门票和漂流，其他收费项目均不包含在套票中，购票若有疑问请咨询商家。
桃花朵朵朵开123,2018/7/3,有山有水，适合一日游
Sept25,2018/7/23,还不错啦 就是第二天全身酸痛 腿粗都不知碰哪儿了 淤青
FYI593547030,2018/6/12,一路奔波二百多公里去的，果然没让我们失望非常棒的一次漂流
LPo528196955,2018/7/25,豫西大峡谷漂流，很刺激，孩子喜欢，很开心！😄️😄️😄️五星好评！
匿名用户,2018/7/25,洞还是挺刺激的，就是还没见过漂流完洗澡还要十块的，正常的漂流完就洗澡呀，乱收钱
匿名用户,2018/7/27,很不错，适合周末和朋友一起去，或者带上家人去避暑
匿名用户,2018/6/30,还不错，就是水不是太干净，去的时候要带上凉鞋、换洗衣物，手机要准备个防水套
vWE736017626,2018/7/19,玩得很开心，刺激，环境优美，项目繁多，就是时间紧迫，没有来得及去百草园玩
rmU188106912,2018/7/25,都挺好的，就是窗口服务有待提高。景点项目值得一去。
mcz512193819,2018/7/25,每年都去漂流很刺激，但是今年去水质不好。
QyT420040426,2018/7/27,很好！很刺激！孩子玩的很开心，下次还会再来
FYI593547030,2018/6/12,豫西大峡谷果然很给力，全程6公里很爽很刺激。
PnO347020886,2018/7/27,还不错，挺好玩，就是价格有点贵
匿名用户,2018/7/1,可以，推荐一下
ZZ,2018/5/1,"设施跟齐全，景点很多，特别是山中腰的那个大瀑布，是整个景区最大的亮点，漂流的话看起来很不错的，会经过很多山洞，但是这次去的时候天气稍微有点凉，虽然已经开放，但还 <span class=""feedbackmore"">是没有体验，下次天气暖和一点，一定再去体验一次，真正的漂流！ <i class=""text-icon icon-toggle-arrow"">"
林llamas,2018/7/20,去过两回了。感觉不错的。下午2点开始一般2到3小时结束就差不多！！！
张女神神,2018/7/27,玩的很好，很刺激，孩子很喜欢，下次还来
bOz597445805,2018/7/25,山美水美，漂流时间长，玩着很过瘾。还想在玩。
jtC463553866,2018/7/25,【环境】 不错、不过一定记得提前购票哦！不然到了要等
Hg我太饿啦,2018/7/11,环境不错，风景优美，水也挺干净的。漂流的过程中有两个山洞非常刺激。在有时间了还会再去。
agQ280920893,2018/7/19,环境很好，漂流河道也很长。水很清澈，很刺激。明年还要跟朋友一起漂
SgG824325127,2018/7/20,没有漂流过，这次漂流是第一次，真的感觉太爽了。有好多处惊险刺激。
二师兄850825,2018/7/27,好
UVv542386921,2018/7/24,挺好的，就是划船有点费劲。刺激，爽。凉快，
函谷风,2018/7/26,玩起来不错，比较刺激
w370471673,2018/6/23,值得推荐 和老婆一起去的 玩的很开心 是刺激
匿名用户,2018/5/12,一家人自驾游过来玩，环境还不错，空气挺好的，就是景区里有好多小飞虫，水也不干净。
bOz597445805,2018/7/25,山清水秀，是个避暑的好地方
匿名用户,2018/5/13,"景区售票处人员服务态度比较好，就是美团售票客服服务态度不好，同时买了四张票，四个小时之内只出了一张票，其他三张没有出来，打客服电话客服解决不了，给了一个所谓的网 <span class=""feedbackmore"">络经理的电话，但是拨打两次是空号，在售票处白白等待四五十分钟，最后不得把剩下的三张票申请退款，浪费消费者的时间 <i class=""text-icon icon-toggle-arrow"">"
Bbt959670429,2018/7/22,整体还不错。两个暗洞挺好玩的。
Qbb244465831,2018/7/23,挺好玩的，很刺激，，值得推荐给朋友！！！！！！！！！！！！！！！！！！！！！！！！
dBB595284579,2018/7/26,很满意，漂流很刺激！
ibw910504970,2018/7/22,环境和想象的差距太大，伤心啊。
匿名用户,2018/7/18,设施挺好 ，挺好玩的 可刺激 就是太短了 水有点不干净
lovelinQL,2018/7/26,漂流很刺激
RVJ342160850,2018/5/1,百草园很不错，大峡谷也很棒。因为这次去带着老人和小孩就没有漂流，光看别人漂都很嗨，下次去一定要漂一次！
AAm602084436,2018/7/24,很好玩，建议早点去
twP154157586,2018/7/19,不错，挺好的，洗澡还要钱，漂流也不包含入场票
国际傲娇小女神。,2018/8/21,还不错 一家人一起去玩的 挺开心 还会再来。
XEx563922865,2018/7/2,愉快的漂流，总体感觉漂流还是不错的。
AAm602084436,2018/7/24,超级好玩
菲儿97393,2018/7/24,挺好玩的
菲儿97393,2018/7/24,挺好玩的
差不多小姐19887,2018/7/18,真心垃圾，服气了，工作人员，态度是什么玩意儿
匿名用户,2018/7/15,就那样，漂流票价有些高了。感觉票价和项目不成比例。
球场恶霸,2018/7/20,那几个山洞还是比较爽的，挺刺激！
Lfs816456112,2018/7/18,设施到位，玩得也很开心，不错不错，可以前来玩耍
Vqw863287878,2018/5/1,跟家人一起去的，那里环境真的很美，让人流连忘返，两个孩子玩的很开心，回来后孩子还闹着要去玩儿呢，有机会会再去的！😊😊😊
lDK245382808,2018/7/21,非常好，水洞可美！
PNc532622012,2018/7/19,漂流很不错，环境很好
Irh615054772,2018/7/19,挺好的，就是天热，玩的很开心
PNc532622012,2018/7/19,环境不错，漂流很刺激
林llamas,2018/7/20,去过两回了。不错
半面妆131419,2018/7/15,服务可以 ，环境让人挺轻松，不错
SAIL21,2018/7/15,很好玩的地方，带着孩子去的，还不错，玩得很开心。
aAn893578354,2018/7/20,真心好玩，下次在去。
DXe467814940,2018/7/7,挺刺激的，媳妇挺满意，就是为啥要收门票 进去就飘了个游，啥景都没，啥都没干收了漂流费还收门票费？？？
Aqs633678759,2018/6/12,环境很不错，而且漂流特别的好玩，大家可以去玩玩
cDM272509953,2018/6/24,漂流不错的，这个百草园就是骗人的，里面有停车场不让车进，坐观光车一个人10元单程，我们进来之后后面都有车进来，就是一个骗子，大家都不要来百草园！！！！！
阳光love微笑,2018/7/2,今天没有白来，比以往的漂流都要刺激，特别是三个漂流穿越黑洞，和朋友们很开心。
匿名用户,2018/7/8,非常不错，刺激好玩，服务设施也比较到位。
WDI415559261,2018/6/11,环境好，空气清新，只去了漂流，好玩，值得一去
小骆蘸大蒜,2018/6/16,挺好的
kYq744378377,2018/5/3,山青水秀，天然氧吧，激情漂流，别出心裁，气温低没能漂流，实感遗憾，有机会了带孩子们去享受一下漂流乐趣
eEE955893299,2018/7/9,漂流很给力，特别是龙门和勇士洞
Asiachen001,2018/7/12,【交通】不错，水不是太干净
匿名用户,2018/6/14,很合适
tct551400846,2018/7/13,门票有点坑，
匿名用户,2018/7/6,景区游玩的项目少，里面很远，车不让进。
nhN688082471,2018/7/7,服务一般般，感觉有点乱，环境很不错，非常喜欢！!
范范范阿范29,2018/6/27,还是挺喜欢的 就是真的晒 防晒什么的一定要做好 手机就不要带上了 我的手机就是这么让水排坏的 哈哈哈
uHK652128971,2018/6/17,刺激风景也不错推荐你们去我已经是第三次带朋友去得
我就是你的故事,2018/7/5,如果不漂流的话就不要去了，漂流还是很好玩的
Yuk420023724,2018/6/29,真心好玩，建议玩儿，特别不错，家人出行，单位团建的好去处
a583410682,2018/7/6,好玩，刺激，很嗨皮。
EYr548219983,2018/6/18,环境可以，还行，下次再去，水质一般。
嗨你好吃货,2018/5/1,配套施舍一般 没有什么景点 瀑布感觉一般 就有一个漂流还可以 百草园什么都没有开还在建设中
Iom869681383,2018/7/6,漂流路线确实不错，值得一来，推荐
陈8985,2018/6/9,漂流还不错，我们去了之后就只漂流，也没逛逛，个人觉得门票跟漂流分开就好了
ygv561728155,2018/7/3,天气不作美 整体还可以 就是消费有点高
dBx522914154,2018/7/3,整体还可以 就是消费有点高 天气不作美
KQy539148749,2018/6/27,挺好玩的。挺刺激。不过建议门票和漂流门票分开就更好了。门票不值 漂流挺好
寻找世间美食,2018/6/25,没有想象中的完美，漂流时间太短，景区工作人员素质太低
穆尔巴西,2018/6/14,等于188元只带漂流，什么景区门票，哪里来的景区，出来淋浴还另收费，不可能再有下次来了。门口小贩卖的水枪还没玩就坏了。
VWp602699723,2018/7/1,漂流挺不错的，过第一个洞子太黑了，吓我一跳
SWG409952630,2018/7/6,漂流爽
hbH718972945,2018/6/15,漂流很刺激 玩的很高兴。下次还会再去👍🏻👍🏻🤩
KQy539148749,2018/6/27,还不错。漂流挺满意的。只买门票的话不值没啥逛的。漂流挺刺激的
Huh涵,2018/7/3,好的没话说
DEz583271656,2018/7/3,好
Cmy宇,2018/6/26,很好玩的地方 要是能多玩几圈就更好了
vRG560127523,2018/7/1,挺不错的很刺激！
vRG560127523,2018/7/1,挺不错的很刺激！
vRG560127523,2018/7/1,挺不错的很刺激！
vRG560127523,2018/7/1,挺不错的很刺激！
vRG560127523,2018/7/1,挺不错的很刺激！
vRG560127523,2018/7/1,挺不错的很刺激！
萱儿_er,2018/5/9,不错，感觉挺好玩的，景也很美，很赞❤️
KQJ245320912,2018/6/21,以后再也不来，没有什么好玩的，能玩的太单一，不值门票钱
你是我的棉花糖,2018/6/19,特别坑，一直等到两点才进入，非常不方便
吃货张巧,2018/6/16,风景优美，十分凉快，适合夏天带孩子和家人朋友来玩
kWh686888472,2018/6/18,很刺激，很爽，去过后还想去。
匿名用户,2018/6/19,挺好的，漂流很刺激，感觉……不虚此行
匿名用户,2018/6/14,很刺激，真的很好玩，到黑洞里面真是美透了
匿名用户,2018/5/12,还可以，漂流看着不错，适合漂流，不适合爬山，有点短， 风景还好，四大人带两孩子 ，一个三岁 全程孩子都基本自己走的， ，，，，，强烈建议，要去就去漂流。
啾啾1234yy,2018/6/12,漂流很棒，百草园什么都没有不推荐去了
xin070922,2018/5/26,比较偏，景点跟普通，没有特点，基本一块石头一个水坑就是一个景点，漂流没看见有人玩，水还比较脏，不推荐去
丸子童,2018/6/10,自驾去的 天气很给力 玩的很开心 以后夏天的必玩项目
JtE137715265,2018/6/12,很好玩很刺激，玩着很过瘾，下次一定继续开玩。哈啊
匿名用户,2018/6/16,挺有意思的😊
JtE137715265,2018/6/12,玩的很开心很刺激，下次一定还会再来嘻嘻
楠1324,2018/6/14,不错，很好玩！
卫liu622,2018/7/25,漂流非常刺激、老公说值得！12点半左右才能漂流哦
热情有限mmmm,2018/6/13,和老婆一起去的，玩的挺开心。
DQm338761524,2018/6/11,玩着不错，值得一玩，得劲完啦。
诺诺诺1115,2018/6/1,除非自己开车去，不然到景区门口都是个问题，没有什么可看的
TDA106699073,2018/6/10,非常不错，很刺激
陶美拉,2018/6/4,很刺激的，很值得一去。比外地的都刺激
Txg189068627,2018/5/26,水有点脏。臭，价格有点贵。各种收费。
匿名用户,2018/5/22,大骗子太坑人了 游览车就送了一段路回来还要坐游览车太坑人了
马娜娜。,2018/5/23,很好玩。和家人一起去的 。人多点更好玩
A695406863,2018/5/16,设施完备，交通便利，环境优美，的确是休闲旅游的最佳之处。
匿名用户,2018/5/20,设施一般，服务一般，天然氧吧，徒步健身
kYq744378377,2018/5/3,山青水秀，天然氧吧，激情漂流，欢乐无限
dZy684402178,2018/4/30,这个景区太坑了，自己开车去车坏半路了，给景区da了100多个电话都没人接，让商家给调换个票都不调，还4A景区，***垃圾，连1A都不算
mcz512193819,2018/5/20,每年都去，很刺激去了还想去
马娜娜。,2018/5/23,很好玩
Mke636483472,2018/5/3,环境很好，漂流因为太迟，赶时间没漂，但看起来不错，周围的农舍卫生也不错，价格便宜。
cKv126719406,2018/5/5,豫西大峡谷的漂流还是很给力的，友情提示多带衣服和鞋子
uDv472688365,2018/4/30,景区有些破败，台阶多且陡，一般般
匿名用户,2018/4/30,还行 【环境】 【交通】 【项目】 【餐饮】
帅气＆国王,2018/3/19,很好
匿名用户,2018/3/5,一般吧，还凑合，去的时候下雨，回来全身湿透，而且那水臭臭的
失心疯的二百五,2017/12/15,超级好玩，刺激，希望下次再去玩
yRv248485459,2018/1/29,一般吧，景色不错就是有待开发，不值得单独跑一趟
shengliok,2018/2/4,很好呀
shengliok,2018/2/4,赞，下次还会去
blP800917759,2018/2/1,啥都要钱不建议去也就漂流可以玩
knA780353825,2018/1/27,可以上次孩子太小没能票，等来年再去
iwK555510191,2018/1/10,还不错，第一次去，总体还是很开心的！
柔情似水,2018/1/11,洋气 可洋气了😊😊😊
匿名用户,2018/8/5,环境很好，漂流不错，开车去的，停车场很大，整体感觉不错
Mzm104239280,2018/1/2,好好
独断成殇,2017/12/27,交通太不方便了，里面路标还有点混乱，
匿名用户,2017/12/30,很刺激
Rwk429101760,2017/12/27,很满意很爽的明年还会去
匿名用户,2017/10/8,景色挺漂亮的，适合夏季漂流，可以停车，还不错，带着老年人和小孩可以多走走。
Z小狐狸、,2017/9/19,我们玩的时候天气挺好的，玩完刚到山下。。就下了大雨。。景色也是美不胜收呐。。漂了一个多小时，就有几处是比较刺激，其他就平平静静，人多划得时候有点拥堵。。不过还可以吧。
棉草糖,2017/7/19,"我是从灵宝出发的，包了个出租车送到景区门口100元，如果自己坐班车的话到卢氏下车，坐包车50元可以到达景区门口，但是车不好找。到那10点多，11点30才开始放水 <span class=""feedbackmore"">，然后可以去窗口换漂流票。每个人60元押金，必须现金，然后给一个手环可以用来消费，柜子使用是10原，淋浴10元。快12点开始漂流，刚开始在一个大的湖面，很兴奋，不会划，划一会就会了，漂流大概有一个多小时吧，到下游以后，可以选择坐景区的车10元到售票处，也可以自己步行走回去，建议步行，不远，还可以欣赏沿路的风景，总之还不错，有一点需要注意的是美团上的票需要提前4个小时团。还不错，感觉漂流要价稍微高了点 <i class=""text-icon icon-toggle-arrow"">"
CCp262957550,2017/11/30,很不错的景区，景色很美，漂流河道不错，值得来玩。
Kwz355652863,2017/11/28,漂流好玩，就是人太多了，还会再去
女女0325,2017/9/24,玩得特别开心，环境真的很赞，漂流很刺激，漂的时间也很长，下次还要来玩。
nDZ602019019,2017/9/17,不是很满意，自我感觉漂流价钱贵了点，然后救生衣很脏，很湿，穿到身上跟不舒服，但是风景不错，回来的时候没有坐车，很热，建议回来坐车。
叽哩咕噜小静,2017/8/20,"怎么说呢，去漂流还得买景区门票，美团210停车明明是5块说白天10块，洗澡收费10元，漂流完了15分钟的车收费30，收费高，漂流只有1个多小时，很惊险刺激吧，去 <span class=""feedbackmore"">过最好的漂流还是尧山大峡谷吧，只有停车收费其他都免费。。 <i class=""text-icon icon-toggle-arrow"">"
寡人不萌,2017/8/27,我们是学生穷游，没有车，过去的交通身不方便没有直达景区门口的车。除此之外玩的还是很开森的，但是漂流去的救生衣真的有好多好多都很脏，希望景区能改善一下。
UFg908913998,2017/7/25,挺好玩的。三个山洞比较刺激。沿途也有有很多瀑布群，唯一不足的是有些地方水浅，搁浅了几次。玩完之后爬了999台阶，真心累！其实有另一个小道风景比较好，也近一些。出了景区在峡谷人家吃了个饭，味道还不错
妙手居,2017/11/11,自驾游，一家三口去的。正是假期，人很多，很尽兴！
yuanjianfeng888,2017/7/23,"漂流很刺激好玩，就是景点少，一个半小时漂流完后，没其他玩的。门票和景区中巴票价偏贵，漂流完没10分钟路程票价30元，孩子5岁不让漂流也没其他玩的，在河边玩玩水， <span class=""feedbackmore"">总觉得意犹未尽，很早就打道回府了，再加点别的刺激项目和表演就更好了。 <i class=""text-icon icon-toggle-arrow"">"
万科朴邻,2017/10/4,还可以，感觉价格有点小贵，还有票价里竟然不含坐车的，这个不尽如人意，我们去年在浙江漂流价格比它便宜还包含坐车的
